{
  "type": "species",
  "name": "human",
  "folder": null,
  "system": {
    "slug": "human",
    "description": "",
    "size": 5,
    "speed": {
      "twoLegs": 10
    },
    "birthrights": [],
    "perks": [],
    "conditionedBirthrights": [],
    "capabilities": [],
    "powerSkills": [],
    "maneuvers": []
  },
  "_id": "p9BuG1bXSsPKRGqI",
  "img": "icons/magic/control/silhouette-grow-shrink-tan.webp",
  "effects": [],
  "flags": {},
  "_stats": {
    "compendiumSource": null,
    "duplicateSource": null,
    "exportSource": null,
    "coreVersion": "13.350",
    "systemId": "fading-suns-4",
    "systemVersion": "0.0.1",
    "createdTime": 1760871251544,
    "modifiedTime": 1760871251544,
    "lastModifiedBy": "ef54fWvGiyPGgegN"
  },
  "ownership": {
    "default": 0,
    "ef54fWvGiyPGgegN": 3
  },
  "sort": 0,
  "_key": "!items!p9BuG1bXSsPKRGqI"
}
